{
  "name": "minimal_orbit_fist",
  "output_path": "minimal_orbit_fist",
  "camhand_rig": {
    "cameras": [
      {
        "name": "cam0",
        "T_b_c": {
          "pos": [0.0, 0.0, 0.0],
          "quat": [0.0, 0.0, 0.0, 1.0]
        },
        "intrinsics": {
          "name": "pinhole",
          "parameters": {
            "fx": 240.0,
            "fy": 240.0,
            "cx": 320.0,
            "cy": 240.0
          }
        },
        "resolution": [640, 480],
        "frequency": 30.0,
        "pixel_format": "MONO8",
        "shutter": "global",
        "exposure": 0,
        "gain": 0,
        "noise_std": 10
      }
    ],
    "hands": [
      {
        "name": "right",
        "model": "../../hand.blend"
      }
    ],
    "T_c_h": [
      [
        {
          "pos": [0.0, 0.0, 0.0],
          "quat": [0.0, 0.0, 0.0, 1.0]
        }
      ]
    ]
  },
  "cam_motions": ["cam_motion_orbit.csv"],
  "hand_motions": ["hand_motion_fist.csv"],
  "hdri": "../../hdri/brown_photostudio_02_2k.exr"
}
